{ 
 "title": "TB outbreak in Nunavik, Canada", 
 "color_options": {
  "gt": {
   "menuItem": "genotype", 
   "legendTitle": "Genotype", 
   "type": "discrete", 
   "key": "genotype"
  },
  "num_date": {
   "menuItem": "date", 
   "legendTitle": "Sampling date", 
   "type": "continuous", 
   "key": "num_date"
  },
  "clade_membership": {
   "menuItem": "Clade",
   "legendTitle": "Clade",
   "type": "discrete",
   "key": "clade_membership"
  },
  "location": {
  },
  "cluster": {
  }
 },
 "geo": [
   "location"
 ],
 "filters": [
  "location", 
  "cluster", 
  "authors"
 ],
  "maintainer": [
    "Emma Hodcroft",
    "https://neherlab.org/emma-hodcroft.html"
  ]
}
