{
  "title": "Real-time tracking of Zika virus evolution",
  "color_options": {
    "gt": {
      "menuItem": "genotype",
      "legendTitle": "Genotype",
      "type": "discrete",
      "key": "genotype"
    },
    "num_date": {
      "menuItem": "date",
      "legendTitle": "Sampling date",
      "type": "continuous",
      "key": "num_date"
    },
    "authors": {
      "key":"authors",
      "legendTitle":"Authors",
      "menuItem":"authors",
      "type":"discrete"
    },
    "country": {
    },
    "region": {
    }
  },
  "geo": [
    "country",
    "region"
  ],
  "maintainer": [
    "Trevor Bedford",
    "http://bedford.io/team/trevor-bedford/"
  ],
  "filters": [
    "country",
    "region",
    "authors"
  ]
}
